Motivo,Fuente,Validación,Páginas
No se ha encontrado (404),Sitio web,Error,35
Bloqueada por robots.txt,Sitio web,Error,15
Página con redirección,Sitio web,Error,7
Rastreada: actualmente sin indexar,Sistemas de Google,Error,7
Duplicada: el usuario no ha indicado ninguna versión canónica,Sitio web,No iniciada,3
Soft 404,Sitio web,No iniciada,1
Descubierta: actualmente sin indexar,Sistemas de Google,No iniciada,1
Página alternativa con etiqueta canónica adecuada,Sitio web,Iniciada,13
Bloqueada por una solicitud no autorizada (401),Sitio web,Iniciada,11